<?xml version="1.0" encoding="UTF-8"?>
<?xml-stylesheet type="text/xsl" href="basicocd.xsl"?>
<CD_OFERTA xmlns:xsi="http://www.w3.org/2001/XMLSchema-instance" xsi:noNamespaceSchemaLocation="basicocd.xsd">
    <CD titulo="Still got the blues">
        <artista>Gary Moore</artista>
        <pais>UK</pais>
        <discografica>Virgin Records</discografica>
        <precio>10.20</precio>
        <Año>1990</Año>
    </CD>
    <CD titulo="One night only">
        <artista>Bee Gees</artista>
        <pais>UK</pais>
        <discografica>Polydor</discografica>
        <precio>10.90</precio>
        <Año>1998</Año>
    </CD>
    <CD titulo="When a man loves a woman">
        <artista>Percy Sledge</artista>
        <pais>USA</pais>
        <discografica>Atlantic</discografica>
        <precio>8.70</precio>
        <Año>1987</Año>
    </CD>
    <CD titulo="Big Willie style">
        <artista>Will Smith</artista>
        <pais>USA</pais>
        <discografica>Columbia</discografica>
        <precio>9.90</precio>
        <Año>1997</Año>
    </CD>
    <CD titulo="La cancion de Juan Perro">
        <artista>Radio Futura</artista>
        <pais>España</pais>
        <discografica>Sony Music-Ariola</discografica>
        <precio>9.90</precio>
        <Año>1987</Año>
    </CD>
    <CD titulo="The dock of the bay">
        <artista>Otis Redding</artista>
        <pais>USA</pais>
        <discografica>Atlantic</discografica>
        <precio>7.90</precio>
        <Año>1987</Año>
    </CD>
</CD_OFERTA>